<?xml version='1.0' encoding='utf-8'?>
<!DOCTYPE residence SYSTEM "residence.dtd">
<residence id="1" name="Gludio" impl="Castle">
	<support level="3" lease="7000"/>
	<support level="13" lease="70000"/>
	<support level="5" lease="21000"/>
	<support level="15" lease="210000"/>
	<support level="7" lease="37000"/>
	<support level="17" lease="370000"/>
	<support level="8" lease="52000"/>
	<support level="18" lease="520000"/>
	<restore_exp level="15" lease="3000"/>
	<restore_exp level="25" lease="9000"/>
	<restore_exp level="35" lease="18000"/>
	<restore_exp level="50" lease="18000"/>
	<restore_hp level="80" lease="1000"/>
	<restore_hp level="120" lease="1500"/>
	<restore_hp level="180" lease="2250"/>
	<restore_hp level="240" lease="3750"/>
	<restore_hp level="300" lease="5166"/>
	<restore_mp level="5" lease="2000"/>
	<restore_mp level="15" lease="6500"/>
	<restore_mp level="30" lease="13750"/>
	<restore_mp level="40" lease="20000"/>
	<teleport level="1" lease="1000">
		<target loc="-15043 116596 -3208" name="1010689" price="0" StringName="Front of the Gludio Castle" StringNameLang="Замок Глудио"/><!--Front of the Gludio Castle-->
		<target loc="-14393 123671 -3144" name="1010663" price="0" StringName="Gludio Town Square" StringNameLang="Площадь Глудио"/><!--Gludio Town Square-->
		<target loc="-58761 154663 -2701" name="1010680" price="0" StringName="Front of the Shanty Fortress" StringNameLang="Ветхая Крепость"/><!--Front of the Shanty Fortress-->
		<target loc="-29856 214275 -3680" name="1010667" price="0" StringName="Front of the Southern Fortress" StringNameLang="Южная Крепость"/><!--Front of the Southern Fortress-->
	</teleport>
	<teleport level="2" lease="2000">
		<target loc="-15043 116596 -3208" name="1010689" price="0" StringName="Front of the Gludio Castle" StringNameLang="Замок Глудио"/><!--Front of the Gludio Castle-->
		<target loc="-14393 123671 -3144" name="1010663" price="0" StringName="Gludio Town Square" StringNameLang="Площадь Глудио"/><!--Gludio Town Square-->
		<target loc="-58761 154663 -2701" name="1010680" price="0" StringName="Front of the Shanty Fortress" StringNameLang="Ветхая Крепость"/><!--Front of the Shanty Fortress-->
		<target loc="-29856 214275 -3680" name="1010667" price="0" StringName="Front of the Southern Fortress" StringNameLang="Южная Крепость"/><!--Front of the Southern Fortress-->
		<target loc="-41248 122848 -2912" name="1010097" price="500" StringName="Ruins of Agony" StringNameLang="Руины Страданий"/><!--Ruins of Agony-->
		<target loc="-19120 136816 -3762" name="1010101" price="500" StringName="Ruins of Despair" StringNameLang="Руины Отчаяния"/><!--Ruins of Despair-->
		<target loc="-9959 176184 -4160" name="1010566" price="500" StringName="The Ant Nest" StringNameLang="Муравейник"/><!--The Ant Nest-->
		<target loc="-28327 155125 -3496" name="1010102" price="500" StringName="Windawood Manor" StringNameLang="Поместье Виндавуд"/><!--Windawood Manor-->
	</teleport>
	<skills>
		<skill id="593" level="1" /> <!--Residence Health-->
		<skill id="600" level="1" /> <!--Residence Guidance-->
		<skill id="606" level="1" /> <!--Residence Fortitude-->
	</skills>
	<banish_points>
		<point x="-15881" y="110651" z="-2770" />
		<point x="-15679" y="110168" z="-2770" />
		<point x="-15553" y="110780" z="-2770" />
		<point x="-15281" y="110142" z="-2770" />
	</banish_points>
	<owner_restart_points>
		<point x="-16554" y="109382" z="-1799" />
		<point x="-16869" y="109375" z="-1799" />
		<point x="-16659" y="109261" z="-1799" />
		<point x="-16618" y="109485" z="-1799" />
	</owner_restart_points>
	<other_restart_points>
		<point x="-81447" y="152760" z="-3170" />
		<point x="-81447" y="152880" z="-3170" />
		<point x="-81447" y="152640" z="-3170" />
		<point x="-82186" y="152760" z="-3170" />
		<point x="-82186" y="152880" z="-3170" />
		<point x="-82186" y="152640" z="-3170" />
		<point x="-81780" y="152760" z="-3170" />
		<point x="-81780" y="152880" z="-3170" />
		<point x="-81780" y="152640" z="-3170" />
	</other_restart_points>
	<chaos_restart_points>
		<point x="-81616" y="157104" z="-3150" />
		<point x="-80688" y="157216" z="-3150" />
		<point x="-79568" y="156960" z="-3150" />
		<point x="-78800" y="157744" z="-3150" />
		<point x="-80448" y="157968" z="-3130" />
		<point x="-81712" y="159536" z="-3230" />
		<point x="-79744" y="160592" z="-3330" />
		<point x="-79584" y="159408" z="-3180" />
		<point x="-74016" y="150656" z="-2800" />
		<point x="-72720" y="149632" z="-2780" />
		<point x="-75904" y="162000" z="-3300" />
		<point x="-75488" y="161472" z="-3250" />
		<point x="-74688" y="160736" z="-3200" />
		<point x="-74352" y="161488" z="-3250" />
		<point x="-76656" y="160768" z="-3280" />
		<point x="-77472" y="160960" z="-3470" />
		<point x="-77776" y="158752" z="-3270" />
		<point x="-80448" y="161488" z="-3420" />
		<point x="-75440" y="162672" z="-3350" />
		<point x="-81760" y="161248" z="-3200" />
	</chaos_restart_points>
	<related_fortresses>
		<domain fortress="101" /> <!--Shanty Fortress-->
		<domain fortress="102" />   <!--Southern Fortress-->
		<boundary fortress="112" /> <!--Floran Fortress-->
		<boundary fortress="113" />  <!--Cloud Mountain Fortress-->
	</related_fortresses>
	<merchant_guards>
		<merchant_guard item_id="6038" npc_id="35030" ssq="cabal_null;cabal_dawn;" max="2" />
		<merchant_guard item_id="6039" npc_id="35031" ssq="cabal_null;cabal_dawn;" max="2" />
		<merchant_guard item_id="6040" npc_id="35032" ssq="cabal_null;cabal_dawn;" max="5" />
		<merchant_guard item_id="6041" npc_id="35033" ssq="cabal_null;cabal_dawn;" max="1" />
		<merchant_guard item_id="6042" npc_id="35034" ssq="cabal_null;cabal_dawn;" max="1" />
		<merchant_guard item_id="6043" npc_id="35035" ssq="cabal_null;cabal_dawn;" max="2" />
		<merchant_guard item_id="6044" npc_id="35036" ssq="cabal_null;cabal_dawn;" max="2" />
		<merchant_guard item_id="6045" npc_id="35037" ssq="cabal_null;cabal_dawn;" max="5" />
		<merchant_guard item_id="6046" npc_id="35038" ssq="cabal_null;cabal_dawn;" max="1" />
		<merchant_guard item_id="6047" npc_id="35039" ssq="cabal_null;cabal_dawn;" max="1" />
		<merchant_guard item_id="6115" npc_id="35020" ssq="cabal_dawn;" max="5" />
		<merchant_guard item_id="6116" npc_id="35021" ssq="cabal_dawn;" max="2" />
		<merchant_guard item_id="6117" npc_id="35022" ssq="cabal_dawn;" max="10" />
		<merchant_guard item_id="6118" npc_id="35023" ssq="cabal_dawn;" max="2" />
		<merchant_guard item_id="6119" npc_id="35024" ssq="cabal_dawn;" max="2" />
		<merchant_guard item_id="6120" npc_id="35025" ssq="cabal_dawn;" max="5" />
		<merchant_guard item_id="6121" npc_id="35026" ssq="cabal_dawn;" max="2" />
		<merchant_guard item_id="6122" npc_id="35027" ssq="cabal_dawn;" max="10" />
		<merchant_guard item_id="6123" npc_id="35028" ssq="cabal_dawn;" max="2" />
		<merchant_guard item_id="6124" npc_id="35029" ssq="cabal_dawn;" max="2" />
		<merchant_guard item_id="6175" npc_id="35040" ssq="cabal_dusk;" max="2" />
		<merchant_guard item_id="6176" npc_id="35041" ssq="cabal_dusk;" max="2" />
		<merchant_guard item_id="6177" npc_id="35042" ssq="cabal_dusk;" max="5" />
		<merchant_guard item_id="6178" npc_id="35043" ssq="cabal_dusk;" max="1" />
		<merchant_guard item_id="6179" npc_id="35044" ssq="cabal_dusk;" max="1" />
		<merchant_guard item_id="6180" npc_id="35045" ssq="cabal_dusk;" max="2" />
		<merchant_guard item_id="6181" npc_id="35046" ssq="cabal_dusk;" max="2" />
		<merchant_guard item_id="6182" npc_id="35047" ssq="cabal_dusk;" max="5" />
		<merchant_guard item_id="6183" npc_id="35048" ssq="cabal_dusk;" max="1" />
		<merchant_guard item_id="6184" npc_id="35049" ssq="cabal_dusk;" max="1" />
		<merchant_guard item_id="6235" npc_id="35050" ssq="cabal_dusk;" max="5" />
		<merchant_guard item_id="6236" npc_id="35051" ssq="cabal_dusk;" max="3" />
		<merchant_guard item_id="6237" npc_id="35052" ssq="cabal_dusk;" max="10" />
		<merchant_guard item_id="6238" npc_id="35053" ssq="cabal_dusk;" max="2" />
		<merchant_guard item_id="6239" npc_id="35054" ssq="cabal_dusk;" max="2" />
		<merchant_guard item_id="6240" npc_id="35055" ssq="cabal_dusk;" max="5" />
		<merchant_guard item_id="6241" npc_id="35056" ssq="cabal_dusk;" max="3" />
		<merchant_guard item_id="6242" npc_id="35057" ssq="cabal_dusk;" max="10" />
		<merchant_guard item_id="6243" npc_id="35058" ssq="cabal_dusk;" max="2" />
		<merchant_guard item_id="6244" npc_id="35059" ssq="cabal_dusk;" max="2" />
		<merchant_guard item_id="6295" npc_id="35060" ssq="cabal_dawn;" max="1" />
		<merchant_guard item_id="6296" npc_id="35061" ssq="cabal_dawn;" max="1" />
		<merchant_guard item_id="3960" npc_id="35010" ssq="cabal_null;cabal_dawn;" max="5" />
		<merchant_guard item_id="3961" npc_id="35011" ssq="cabal_null;cabal_dawn;" max="3" />
		<merchant_guard item_id="3962" npc_id="35012" ssq="cabal_null;cabal_dawn;" max="10" />
		<merchant_guard item_id="3963" npc_id="35013" ssq="cabal_null;cabal_dawn;" max="2" />
		<merchant_guard item_id="3964" npc_id="35014" ssq="cabal_null;cabal_dawn;" max="2" />
		<merchant_guard item_id="3965" npc_id="35015" ssq="cabal_null;cabal_dawn;" max="5" />
		<merchant_guard item_id="3966" npc_id="35016" ssq="cabal_null;cabal_dawn;" max="3" />
		<merchant_guard item_id="3967" npc_id="35017" ssq="cabal_null;cabal_dawn;" max="10" />
		<merchant_guard item_id="3968" npc_id="35018" ssq="cabal_null;cabal_dawn;" max="2" />
		<merchant_guard item_id="3969" npc_id="35019" ssq="cabal_null;cabal_dawn;" max="2" />
		<merchant_guard item_id="3970" npc_id="35092" ssq="cabal_null;cabal_dawn;cabal_dusk;" max="1" />
		<merchant_guard item_id="3971" npc_id="35093" ssq="cabal_null;cabal_dawn;cabal_dusk;" max="1" />
		<merchant_guard item_id="3972" npc_id="35094" ssq="cabal_null;cabal_dawn;cabal_dusk;" max="1" />
	</merchant_guards>
</residence>