<?xml version='1.0' encoding='utf-8'?>
<!DOCTYPE residence SYSTEM "residence.dtd">
<residence id="108" name="White Sands Fortress" impl="Fortress">
	<support level="7" lease="49000"/>
	<support level="17" lease="490000"/>
	<support level="8" lease="120000"/>
	<support level="18" lease="1200000"/>
	<restore_exp level="45" lease="63000"/>
	<restore_exp level="50" lease="70000"/>
	<restore_hp level="300" lease="12000"/>
	<restore_hp level="400" lease="20000"/>
	<restore_mp level="40" lease="45000"/>
	<restore_mp level="50" lease="65000"/>
	<teleport level="1" lease="1000">
		<target loc="116336 203775 -3336" name="1010656" price="0" StringName="Fortress West Gate" StringNameLang="Западные врата Крепости"/><!--Fortress West Gate-->
		<target loc="120487 206093 -3336" name="1010657" price="0" StringName="Fortress East Gate" StringNameLang="Восточные врата Крепости"/><!--Fortress East Gate-->
		<target loc="111455 219400 -3546" name="1010686" price="0" StringName="Heine Town Square" StringNameLang="Площадь Хейна"/><!--Heine Town Square-->
		<target loc="117608 241660 -1408" name="1010684" price="0" StringName="Front of the Innadril Castle Gate" StringNameLang="Врата Замка Иннадрил"/><!--Front of the Innadril Castle Gate-->
	</teleport>
	<teleport level="2" lease="10000">
		<target loc="116336 203775 -3336" name="1010656" price="0" StringName="Fortress West Gate" StringNameLang="Западные врата Крепости"/><!--Fortress West Gate-->
		<target loc="120487 206093 -3336" name="1010657" price="0" StringName="Fortress East Gate" StringNameLang="Восточные врата Крепости"/><!--Fortress East Gate-->
		<target loc="111455 219400 -3546" name="1010686" price="0" StringName="Heine Town Square" StringNameLang="Площадь Хейна"/><!--Heine Town Square-->
		<target loc="117608 241660 -1408" name="1010684" price="0" StringName="Front of the Innadril Castle Gate" StringNameLang="Врата Замка Иннадрил"/><!--Front of the Innadril Castle Gate-->
		<target loc="80987 182423 -3504" name="1010704" price="500" StringName="Field of Silence Center" StringNameLang="Сердце Полей Безмолвия"/><!--Field of Silence Center-->
		<target loc="86147 218268 -3592" name="1010705" price="500" StringName="Field of Whispers Center" StringNameLang="Сердце Шепчущих Полей"/><!--Field of Whispers Center-->
		<target loc="113708 178387 -3232" name="1010606" price="500" StringName="The Center of Alligator Island" StringNameLang="Центр Острова Аллигаторов"/><!--The Center of Alligator Island-->
		<target loc="82693 242220 -6712" name="1010526" price="500" StringName="Inside the Garden of Eva" StringNameLang="Внутри Садов Богини Евы"/><!--Inside the Garden of Eva-->
	</teleport>
	<skills>
		<skill id="592" level="1" /> <!--Residence Soul-->
		<skill id="599" level="1" /> <!--Residence Magic Barrier-->
	</skills>
	<banish_points>
		<point x="124651" y="207877" z="-3184" />
		<point x="124482" y="207906" z="-3192" />
		<point x="113959" y="201830" z="-3488" />
		<point x="114053" y="201766" z="-3496" />
	</banish_points>
	<owner_restart_points>
		<point x="118740" y="204589" z="-3008" />
		<point x="118598" y="204592" z="-3008" />
		<point x="118468" y="204458" z="-3008" />
	</owner_restart_points>
	<other_restart_points>
		<point x="107568" y="218256" z="-3624" />
		<point x="107920" y="218240" z="-3624" />
		<point x="107808" y="217856" z="-3624" />
		<point x="108032" y="218048" z="-3624" />
		<point x="107552" y="218000" z="-3624" />
		<point x="110912" y="219584" z="-3624" />
		<point x="110768" y="219824" z="-3624" />
		<point x="110688" y="220576" z="-3624" />
		<point x="110896" y="220768" z="-3624" />
		<point x="111856" y="220752" z="-3624" />
		<point x="112112" y="220576" z="-3624" />
		<point x="112064" y="219792" z="-3624" />
		<point x="111888" y="219584" z="-3624" />
	</other_restart_points>
	<chaos_restart_points>
		<point x="117872" y="225536" z="-3200" />
		<point x="118064" y="225648" z="-3200" />
		<point x="101696" y="221808" z="-3520" />
		<point x="101552" y="221568" z="-3520" />
		<point x="100784" y="218272" z="-3420" />
		<point x="100928" y="218560" z="-3420" />
	</chaos_restart_points>

</residence>